{
  "version": 1,
  "mode": "headless",
  "action": "new:p2t",
  "normalizedInput": {
    "action": "new:p2t",
    "name": "source-project-template",
    "repoUrl": "",
    "projectPath": "C:/Users/Juan/Documents/git/some-local-project",
    "target": "core/templates"
  },
  "preflight": {
    "ok": false,
    "errors": [
      "projectPath no existe: C:/Users/Juan/Documents/git/some-local-project"
    ],
    "warnings": []
  },
  "execution": {
    "steps": [
      "Resolver skill por accion new:*",
      "Validar input contra contrato canonico",
      "Ejecutar preflight estricto",
      "Analizar proyecto origen y mapear artefactos reutilizables",
      "Proponer estructura de template y reglas de parametrizacion",
      "Persistir plan determinista para auditoria"
    ],
    "outDir": "C:\\Users\\Juan\\Documents\\git\\health-platform-challenge\\ops\\plans",
    "preflight": {
      "ok": false,
      "errors": [
        "projectPath no existe: C:/Users/Juan/Documents/git/some-local-project"
      ],
      "warnings": []
    }
  },
  "analysis": {
    "hasPackageJson": false,
    "hasDockerCompose": false,
    "hasNodeBackendHints": false,
    "hasReactFrontHints": false,
    "hasDbHints": false,
    "reusableCandidates": []
  },
  "next": "Corregi errores de preflight y reintenta."
}
